{
  "schemaVersion": 1,
  "namespace": "ui",
  "featureNamespace": "ui",
  "features": [
    {
      "bit": 2,
      "name": "mutation_transactions",
      "lifecycle": {
        "status": "active",
        "introduced": { "major": 1, "minor": 0 },
        "deprecated": null,
        "removed": null,
        "replacement": null
      }
    },
    {
      "bit": 3,
      "name": "semantics",
      "lifecycle": {
        "status": "active",
        "introduced": { "major": 1, "minor": 0 },
        "deprecated": null,
        "removed": null,
        "replacement": null
      }
    }
  ],
  "types": [
    {
      "name": "CommitReceipt",
      "kind": "record",
      "fields": [
        { "name": "sequence", "type": "u32", "optional": false },
        { "name": "dirtyFlags", "type": "u32", "optional": false }
      ],
      "lifecycle": {
        "status": "active",
        "introduced": { "major": 1, "minor": 0 },
        "deprecated": null,
        "removed": null,
        "replacement": null
      }
    },
    {
      "name": "Semantics",
      "kind": "record",
      "fields": [
        { "name": "role", "type": "string", "optional": true },
        { "name": "label", "type": "string", "optional": true },
        { "name": "value", "type": "string", "optional": true },
        { "name": "description", "type": "string", "optional": true },
        { "name": "disabled", "type": "bool", "optional": true }
      ],
      "lifecycle": {
        "status": "active",
        "introduced": { "major": 1, "minor": 0 },
        "deprecated": null,
        "removed": null,
        "replacement": null
      }
    }
  ],
  "nodeTypes": [
    {
      "id": 0,
      "name": "Root",
      "handleKind": "common.Node",
      "requiresFeatures": [],
      "lifecycle": {
        "status": "active",
        "introduced": { "major": 1, "minor": 0 },
        "deprecated": null,
        "removed": null,
        "replacement": null
      }
    },
    {
      "id": 1,
      "name": "View",
      "handleKind": "common.Node",
      "requiresFeatures": [],
      "lifecycle": {
        "status": "active",
        "introduced": { "major": 1, "minor": 0 },
        "deprecated": null,
        "removed": null,
        "replacement": null
      }
    },
    {
      "id": 2,
      "name": "Text",
      "handleKind": "common.Node",
      "requiresFeatures": [],
      "lifecycle": {
        "status": "active",
        "introduced": { "major": 1, "minor": 0 },
        "deprecated": null,
        "removed": null,
        "replacement": null
      }
    },
    {
      "id": 3,
      "name": "Image",
      "handleKind": "common.Node",
      "requiresFeatures": [],
      "lifecycle": {
        "status": "active",
        "introduced": { "major": 1, "minor": 0 },
        "deprecated": null,
        "removed": null,
        "replacement": null
      }
    },
    {
      "id": 4,
      "name": "Scroll",
      "handleKind": "common.Node",
      "requiresFeatures": [],
      "lifecycle": {
        "status": "active",
        "introduced": { "major": 1, "minor": 0 },
        "deprecated": null,
        "removed": null,
        "replacement": null
      }
    }
  ],
  "properties": [
    {
      "id": 1,
      "name": "Width",
      "valueType": "f64",
      "nullable": true,
      "clear": { "mode": "unset", "default": null },
      "requiresFeatures": ["ui.mutation_transactions"],
      "lifecycle": {
        "status": "active",
        "introduced": { "major": 1, "minor": 0 },
        "deprecated": null,
        "removed": null,
        "replacement": null
      }
    },
    {
      "id": 2,
      "name": "Height",
      "valueType": "f64",
      "nullable": true,
      "clear": { "mode": "unset", "default": null },
      "requiresFeatures": ["ui.mutation_transactions"],
      "lifecycle": {
        "status": "active",
        "introduced": { "major": 1, "minor": 0 },
        "deprecated": null,
        "removed": null,
        "replacement": null
      }
    },
    {
      "id": 3,
      "name": "MinWidth",
      "valueType": "f64",
      "nullable": true,
      "clear": { "mode": "unset", "default": null },
      "requiresFeatures": ["ui.mutation_transactions"],
      "lifecycle": {
        "status": "active",
        "introduced": { "major": 1, "minor": 0 },
        "deprecated": null,
        "removed": null,
        "replacement": null
      }
    },
    {
      "id": 4,
      "name": "MinHeight",
      "valueType": "f64",
      "nullable": true,
      "clear": { "mode": "unset", "default": null },
      "requiresFeatures": ["ui.mutation_transactions"],
      "lifecycle": {
        "status": "active",
        "introduced": { "major": 1, "minor": 0 },
        "deprecated": null,
        "removed": null,
        "replacement": null
      }
    },
    {
      "id": 5,
      "name": "Padding",
      "valueType": "f64",
      "nullable": true,
      "clear": { "mode": "default", "default": 0 },
      "requiresFeatures": ["ui.mutation_transactions"],
      "lifecycle": {
        "status": "active",
        "introduced": { "major": 1, "minor": 0 },
        "deprecated": null,
        "removed": null,
        "replacement": null
      }
    },
    {
      "id": 6,
      "name": "Gap",
      "valueType": "f64",
      "nullable": true,
      "clear": { "mode": "default", "default": 0 },
      "requiresFeatures": ["ui.mutation_transactions"],
      "lifecycle": {
        "status": "active",
        "introduced": { "major": 1, "minor": 0 },
        "deprecated": null,
        "removed": null,
        "replacement": null
      }
    },
    {
      "id": 7,
      "name": "FlexDirection",
      "valueType": "u32",
      "nullable": true,
      "clear": { "mode": "default", "default": 0 },
      "requiresFeatures": ["ui.mutation_transactions"],
      "lifecycle": {
        "status": "active",
        "introduced": { "major": 1, "minor": 0 },
        "deprecated": null,
        "removed": null,
        "replacement": null
      }
    },
    {
      "id": 8,
      "name": "AlignItems",
      "valueType": "u32",
      "nullable": true,
      "clear": { "mode": "default", "default": 0 },
      "requiresFeatures": ["ui.mutation_transactions"],
      "lifecycle": {
        "status": "active",
        "introduced": { "major": 1, "minor": 0 },
        "deprecated": null,
        "removed": null,
        "replacement": null
      }
    },
    {
      "id": 9,
      "name": "JustifyContent",
      "valueType": "u32",
      "nullable": true,
      "clear": { "mode": "default", "default": 0 },
      "requiresFeatures": ["ui.mutation_transactions"],
      "lifecycle": {
        "status": "active",
        "introduced": { "major": 1, "minor": 0 },
        "deprecated": null,
        "removed": null,
        "replacement": null
      }
    },
    {
      "id": 10,
      "name": "BackgroundColor",
      "valueType": "u32",
      "nullable": true,
      "clear": { "mode": "unset", "default": null },
      "requiresFeatures": ["ui.mutation_transactions"],
      "lifecycle": {
        "status": "active",
        "introduced": { "major": 1, "minor": 0 },
        "deprecated": null,
        "removed": null,
        "replacement": null
      }
    },
    {
      "id": 11,
      "name": "BorderRadius",
      "valueType": "f64",
      "nullable": true,
      "clear": { "mode": "default", "default": 0 },
      "requiresFeatures": ["ui.mutation_transactions"],
      "lifecycle": {
        "status": "active",
        "introduced": { "major": 1, "minor": 0 },
        "deprecated": null,
        "removed": null,
        "replacement": null
      }
    },
    {
      "id": 12,
      "name": "Opacity",
      "valueType": "f64",
      "nullable": true,
      "clear": { "mode": "default", "default": 1 },
      "requiresFeatures": ["ui.mutation_transactions"],
      "lifecycle": {
        "status": "active",
        "introduced": { "major": 1, "minor": 0 },
        "deprecated": null,
        "removed": null,
        "replacement": null
      }
    },
    {
      "id": 13,
      "name": "FontSize",
      "valueType": "f64",
      "nullable": true,
      "clear": { "mode": "default", "default": 16 },
      "requiresFeatures": ["ui.mutation_transactions"],
      "lifecycle": {
        "status": "active",
        "introduced": { "major": 1, "minor": 0 },
        "deprecated": null,
        "removed": null,
        "replacement": null
      }
    },
    {
      "id": 14,
      "name": "FontWeight",
      "valueType": "u32",
      "nullable": true,
      "clear": { "mode": "default", "default": 400 },
      "requiresFeatures": ["ui.mutation_transactions"],
      "lifecycle": {
        "status": "active",
        "introduced": { "major": 1, "minor": 0 },
        "deprecated": null,
        "removed": null,
        "replacement": null
      }
    },
    {
      "id": 15,
      "name": "TextColor",
      "valueType": "u32",
      "nullable": true,
      "clear": { "mode": "default", "default": 286795775 },
      "requiresFeatures": ["ui.mutation_transactions"],
      "lifecycle": {
        "status": "active",
        "introduced": { "major": 1, "minor": 0 },
        "deprecated": null,
        "removed": null,
        "replacement": null
      }
    },
    {
      "id": 16,
      "name": "ScrollOffsetY",
      "valueType": "f64",
      "nullable": true,
      "clear": { "mode": "default", "default": 0 },
      "requiresFeatures": ["ui.mutation_transactions"],
      "lifecycle": {
        "status": "active",
        "introduced": { "major": 1, "minor": 0 },
        "deprecated": null,
        "removed": null,
        "replacement": null
      }
    },
    {
      "id": 17,
      "name": "FlexGrow",
      "valueType": "f64",
      "nullable": true,
      "clear": { "mode": "default", "default": 0 },
      "requiresFeatures": ["ui.mutation_transactions"],
      "lifecycle": {
        "status": "active",
        "introduced": { "major": 1, "minor": 0 },
        "deprecated": null,
        "removed": null,